"Yes","""Storage, WebView, IPC, 3rd-party librairies, debug mode""","No","Yes","No","No","Yes","""""Vulnerability detection in recent Android apps: An empirical study""""","""""With the continuous and rapid increase in quantity and diversity of Smartphone application usage, the storage of sensitive personal and even financial information of the users is also being augmented. It creates motivation for developers of malicious applications to put more effort on discovering ways to identify and exploit the vulnerabilities of utility applications and grab the sensitive information of the users. Android applications, being more open in nature and popular among armature individual developers, fall victim to the malwares quite frequently. Recently, the Govt. of Bangladesh has taken initiative to encourage and patronize young developers to develop utility apps for free public use in the context of Bangladesh (app source: EATL1). While the motivation is great, i.e., benefiting common people, the way these are developed and released have reasons to suspect that recent vulnerabilities may exist due. This may harm the users and ruin the good initiative. In this paper, we have carried out an empirical study on a selected set of these apps to detect eight common vulnerabilities. We have carefully chosen three quality tools that cover testing of all these vulnerabilities. We reported the detected results showing vulnerabilities in the tested apps, presented statistics of the vulnerabilities and discussed countermeasures. We believe this study would benefit the developers and indirectly the potential users of these applications.""""","Yes","""""F. H. Shezan; S. F. Afroze; A. Iqbal""""","2017","10.1109/NSysS.2017.7885802","https://ieeexplore.ieee.org/stamp/stamp.jsp?arnumber=7885802","IEEE Conferences"
"","""Security and privacy""","No","Yes","Yes","No","Yes","""""State of Survey: Advancement of Knowledge Environmental Sustainability in Practicing Administrative Apps""""","""""Digital technology is growing rapidly in the country. The use of smartphone applications is increasing in Bangladesh, at the same time there are some apps that are important in daily life, whether it is for fun or work by downloading apps on mobile phones. Bangladesh is in an explosive position in terms of app usage to increase internet usage. As modernity has increased, so has the use of apps in consumer performance ( personal or official work, food ordering or online ticketing, banking transactions). However, leaking consumer privacy through the app is now the biggest concern in growing Bangladesh. Reports of privacy violations were also published in various media outlets in Bangladesh. We have completed the work with 310 responses via a survey on how many government app users there are in Bangladesh and why they are reluctant to use the app. Our data collection target was vast but we could not collect more than 310 because the maximum number of people in Bangladesh do not use government apps. In survey analysis, we have learned that people in Bangladesh are not interested in using government apps due to insecurity, simplicity, bugs, UI UX design and reliability issues. Based on our results, the use of these apps will increase if the government can develop apps based on the key points that have been highlighted. In the future, we will use machine learning and deep learning to find out the rate of users’ willingness to use apps, unwillingness, design, bugs, security, etc. As well as ways to increase the use of apps.""""","Yes","""""S. S. Bandan; M. Rahman Ajmain; A. R. Rejuan; M. Farhana Khatun; S. A. Khushbu""""","2022","10.1109/ICCCNT54827.2022.9984416","https://ieeexplore.ieee.org/stamp/stamp.jsp?arnumber=9984416","IEEE Conferences"
"Yes","""Malware""","No","Yes","No","No","Yes","""""Malware analysis in mobile devices""""","""""Mobile Devices are used worldwide nowadays and are being used for most of the tasks we do in our everyday lives. This becomes a good reason for bad people to exploit you somehow. One of the ways is through malware attacks. It can harm us by exploiting our privacy, showing advertisements on our mobile devices, browser exploitation, data tampering, phishing, etc. In India, more than 740 million people are using smartphones, approximately 54% of India's population, and the number of users is increasing each year which makes them all vulnerable to such attacks. There are many ways to detect malware hidden in our phones, prevent such attacks, and maintain our privacy. In this paper, we will discuss the approaches we can take to ensure all the users are secure and protected, and we will be talking about pegasus spyware, why this is so dangerous, and how we can stay protected from such malware. We will also be discussing an implementation that can be used to detect malware and alert users to take the necessary steps to make the device secure again.""""","Yes","""""P. Agarwal; A. Nair; S. Jaiswal; N. Batra; P. Grover""""","2022","10.1049/icp.2022.0604","https://ieeexplore.ieee.org/stamp/stamp.jsp?arnumber=9800432","IET Conferences"
"No","""Malware""","No","Yes","Yes","Yes","No","""""The need of awareness in cyber security with a case study""""","""""The security of information is still now a severe challenge to thwart the threats due to the lack of control on security breaches and awareness in the society. In this paper we elaborated a brief survey about anomalies related to cyber security in emerging applications as well as present information ingredients in the world. So this survey has concentrated on top malicious threats and malwares found in last three years. Finally we proposed a 3-Layer Security Paradigm (3-LSP) is suitable in all aspects of technological trends of huge expanded potential areas. The Layer-1 has a multilevel security model to aware of the threats by a traditional security ethics. In this layer we have given a case study on banking sector in India with new concept called ingredients of information by taking real time examples of cyber threats. This paper covered only Layer-1 with awareness statistics on spam, but Layer-2 and Layer-3 are optional here.""""","","""""G. R. Jidiga; P. Sammulal""""","2013","10.1109/ICCCNT.2013.6726789","https://ieeexplore.ieee.org/stamp/stamp.jsp?arnumber=6726789","IEEE Conferences"
"","""""","No","Yes","No","No","Yes","""""Note taking application with optical character recognition and bio-metric security""""","""""Notes are some other fashionable notepad-like apps for Android Devices, used in general to prepare the text. It is an easy and smooth UI to make and arrange works easy. These days, smartphones are the maximum not unusual place digital tool used in a commercial enterprise in addition to fashionable consumers, and note-taking is the maximum important in numerous businesses. But with inside the case of the not unusual place of human beings' mindset (in India), those notetaking programs are used to store passwords and banking details. Other apps offer protection to note-taking with protection features like pin/password/key. These might not be the maximum stable manner to defend and want to stable the statistics as a lot as possible. This may be accomplished via bio-metric protection, which measures a few bodily factors of someone who is attempting to get admission to touchy statistics. This bio-metric machine measures a man and women's fingerprints features like length and shape or facial features like head shape, nose position, etc., — to affirm whether that man or woman is the equal person who has formerly obtained authorization to get admission to the touchy statistics. The bio-metric era isn't a completely unique answer for authentication and gets admission to issues, however for maximum protection answers, biometrics are the fine answers. Here in our work, we are imposing bio-metric protection to the note-taking programs for android using cryptography protection with private key cryptography algorithms. In addition to security, we have also implemented optical character recognition so that users can also scan documents and capture text in applications.""""","","""""M. P. Kashyap; N. Sanket; T. Amrutha; C. Akhila; T. Madhuri""""","2021","10.1049/icp.2022.0321","https://ieeexplore.ieee.org/stamp/stamp.jsp?arnumber=9770677","IET Conferences"
"No","""Insecure Communication, Cryptography, Storage""","No","Yes","No","No","Yes","""""Effective Security Testing of Mobile Applications for Building Trust in the Digital World""""","""""In recent years, mobile applications have become increasingly important. These applications differ significantly from desktop and web applications, and being used increasingly in various enterprise domains. Accordingly, this motivates the mobile industries to increase the accessibility of mobile applications and their development across many platforms, including Android and iPhone. This research work discusses the security testing procedure and features of India's first indigenous AppStore “mSeva AppStore”. To ensure the quality of the hosted mobile applications, distinct techniques, and effective testing approaches are required. Before hosting the application on mSeva AppStore regressive testing is performed in all aspects like insecure permissions, data storage, secure logic, proper platform algorithms, etc. However, in the current mobile application testing scenario, other AppStore does not consider all factors before hosting the applications, which is quite necessary. This study highlights the key terminologies of mobile application testing and quality parameters. Further, demonstrates the actual results that are obtained during the security testing of various applications. Along with this, the first-ever Common Weakness Enumeration (CWE) based classification regarding common artifacts in mobile application testing is provided. The peculiarities discussed with respect to mobile applications and the testing requirements in the context of secure hosting will help the relevant researcher and stakeholders in this field.""""","Yes","""""K. Kant Kamal; P. Joshi; A. Bang; K. Bhatia""""","2023","10.1109/ICOEI56765.2023.10125814","https://ieeexplore.ieee.org/stamp/stamp.jsp?arnumber=10125814","IEEE Conferences"
"No","""Access control""","No","Yes","No","No","Yes","""""UPI Based Mobile Banking Applications – Security Analysis and Enhancements""""","""""Technology advancements have reduced the cost of both a mobile device and data connection making it affordable to all. In parallel, mobile applications are also rising providing the quick, easy door-step solution(s) to one's professional and personal requirements. In the current trend of the digital and cashless economy, mobile-based app solutions are easy to use and ubiquitous, facilitating a wide range of banking financial services (pay/collect money etc.) and non-financial services (cheque request, account balance, view transaction history etc.). Mobile app revolution is also accompanied by many known and unknown security risks. Out of the various mobile banking applications, UPI (Unified Payment Interface) based apps are simple, reliable, centrally certified (by NPCI (National Payment Corporation of India)) and more secured. Study of UPI apps revealed the possibility of further security enhancements utilizing technological advancements to detect cybercrimes and fraudulent mobile transactions. This paper discusses UPI based mobile apps (architecture, transactions, features and security issues) and information security enhancement proposals w.r.t authentication and authorization.""""","Yes","""""K. K. Lakshmi; H. Gupta; J. Ranjan""""","2019","10.1109/AICAI.2019.8701396","https://ieeexplore.ieee.org/stamp/stamp.jsp?arnumber=8701396","IEEE Conferences"
"No","""""","No","No","Yes","No","Yes","""""Mobile App Usability Index (MAUI) for improving mobile banking adoption""""","""""India has 790+ million active mobile connections and 80.57 million smartphone users. However, as per Reserve Bank of India, the number of transactions performed using smartphone based mobile banking applicationsis less than 12% of the overall banking transactions. One of the major reasons for such low numbers is the usability of the mobile banking app. In this paper, we focus on usability issues related tomobile banking apps and propose a Mobile App Usability Index (MAUI) for enhancing the usability of a mobile banking app. The proposed Index has been validatedwith mobile banking channel managers, chief information security officers, etc.""""","","""""L. Mohan; N. Mathur; Y. R. Reddy""""","2015","","https://ieeexplore.ieee.org/stamp/stamp.jsp?arnumber=7320375","IEEE Conferences"
"Yes","""IPC, WebView, Insecure Communication, Storage, Cryptography""","No","Yes","No","No","Yes","""""Finding Vulnerabilities in E-Governance Apps of Android Platform""""","""""Around the globe, mobile devices like Smartphones, PDAs & tablets are playing an essential role in every person's day to day life. Out of various operating systems, Android OS is one of the most popular and user-friendly operating system for mobile devices. The Government of India is continuously focusing on digitizing its services to the citizen, so that maximum individuals can get benefit of these services and also it removes the middle man culture and minimize the corruption. Inspired by the steps of Government of India, many state governments also works in the same direction and made their services online through mobile applications. In this paper, we have analyzed some mobile applications of Madhya Pradesh Government and an exhaustive assessment has been done for Apps Vulnerability. After analyzing these apps, authors proposed some recommendations in the conclusion of the paper.""""","Yes","""""A. Ankur; S. Patel""""","2022","10.1109/ICTACS56270.2022.9988647","https://ieeexplore.ieee.org/stamp/stamp.jsp?arnumber=9988647","IEEE Conferences"
"Yes","""Malware""","No","Yes","No","No","Yes","""""Security Issues of Unified Payments Interface and Challenges: Case Study""""","""""NPCI, which stands for National Payment Corporation of India, was the organisation behind the idea of UPI, a user-friendly system in which funds can be directly transferred from the bank account to the account using a mobile phone. UPI is based on the concept of 1 click 2-factor authentication. The first factor is the user’s mobile phone itself, and the second factor is MPIN or bio-metrics. It is based on the IMPS(Immediate Payment Service), but there are considerable differences between both services, and we will observe it. With a foresight to make the Indian economy cashless, it helps people transfer funds in an immediate and real-time process. It has played a major role in the revolution of cashless transactions in India. Although significant UPI users are minor and much lesser compared to the Indian population, over 2.07 billion transactions per month have been made by UPI by October 2020, which makes it our essential part of our day-to-day life. This paper will discuss the working of UPI, how UPI is different from conventional cashless transaction methods. After that, we will discuss how the attacker can find the UPI’s loopholes (here we reviewed UPI BHIM 1.0) and empty the victim’s bank account. The attacker can make these attacks remotely, and these attacks can affect a single user to multiple users. We will also discuss how the attacker can achieve his/her goal using a malicious App. In the end, we will see how UPI BHIM 2.0 update was successful in covering this security loophole.""""","Yes","""""Y. Madwanna; M. Khadse; B. R. Chandavarkar""""","2021","10.1109/ICSCCC51823.2021.9478078","https://ieeexplore.ieee.org/stamp/stamp.jsp?arnumber=9478078","IEEE Conferences"
"","""""","No","Yes","No","Yes","No","""""Cyber Threats and Scams in FinTech Organizations: A brief overview of financial fraud cases, future challenges, and recommended solutions in Bangladesh""""","""""The idea of financial systems has changed with the touch of applications based on information technology and came up with a new terminology called ‘FinTech’ (Financial Technology). With the rising technology, Fintech has become a modern phenomenon. Financial organizations deal with highly confidential and sensitive information, including personal and financial data, all of which are the primary target of cybercriminals. Users and other stakeholders are massive in number, and many are not concerned about security, so they often find themselves as victims. The result of the study shows that from the perspective of Bangladesh, most of the attacks on the fintech industry are generated using ransomware and social engineering methods. It also shows that app-based Mobile Financial System (MFS) is the most affected sector in the financial system. The study provides a comprehensive framework, FinSec, which refers to the financial Security Framework to protect from cyber-attacks targeting any financial organization. It covers recommendations for regular end-users and anybody working in the financial sector. It also provides an architecture based on Consortium Blockchain, Hyper-ledger Fabric in a hybrid cloud to ensure a high level of security at the application level. Additionally, the framework proposes newer Three-Way Authentication (3WA) and Gamification to protect end-users. The research emphasizes ensuring a minimum level of training, as even after ensuring everything, massive damage can occur for the simplest mistake of the individuals related to the industry. To protect the financial system, from end-users to employees and user applications to the whole infrastructure, everything, and everyone should be secured. The framework hence recommends three subunits – Action, Knowledge, and Simulation Unit. These subunits protect the respective sector and, finally, end up protecting the fintech organizations.""""","","""""M. J. Hossain; R. H. Rifat; M. H. Mugdho; M. Jahan; A. A. Rasel; M. A. Rahman""""","2022","10.1109/ICIMCIS56303.2022.10017467","https://ieeexplore.ieee.org/stamp/stamp.jsp?arnumber=10017467","IEEE Conferences"
"No","""""","No","Yes","No","No","Yes","""""Integrating OAuth and Aadhaar with e-Health care System""""","""""Smartphone based E-health applications have the potential to change the way in which information is being exchanged between various stakeholders present in the medical industry by providing quick access to processed medical data on the go. E-health applications have gained wide acceptance among the doctor community because of their ability to help doctors in understanding the various pattern of symptoms that show up in the initial stages of a disease or during a relapse which in turn saves a lot of time and lives. These applications have also been used by a lot of patients to get instant access to their medical history which otherwise would have not have been possible with the traditional way of maintaining printed medical records in a file. Health records of a patient usually contain sensitive information and digitalization of these records will significantly increase the chances of private data falling into the wrong hands so it is very critical to provide secured access mechanisms to all the stakeholders present in this system and ensure users privacy. Medical data breach can be avoided by the implementation of various authentication and authorization techniques wherever necessary. Health care sector doesn't have a centralized way of identifying a patient and this decreases the feasibility of large scale storage and maintenance of the medical records provided by various doctors. Ever since the introduction of Aadhaar in India, all the major organizations have put in immense amount of effort to link various users accounts to their Aadhaar number and this has turned out to be very beneficial because it has reduced the processing time, reduced the leakage in the system and also eradicate the duplicity of account in sectors like LPG Subsidy, Academic Scholarship, Crop Insurance etc. Through this work, approaches involved in design and implementation of an Aadhaar based E Health application with OAuth is discussed.""""","Yes","""""A. Khatoon; V. Umadevi""""","2018","10.1109/RTEICT42901.2018.9012487","https://ieeexplore.ieee.org/stamp/stamp.jsp?arnumber=9012487","IEEE Conferences"
"","""""","No","Yes","No","Yes","No","""""Encryption Policies of Social Media Apps and Its Effect on User's Privacy""""","""""The motive behind this research paper is to outline recently introduced social media encryption policies and the impact that they will have on user privacy. With close to no Data Protection Laws in the country, all social media platforms pose a threat to one's privacy. The various new privacy policies that have been put in place across different social media platforms, tend to take away the user's choice on whether they want their data shared with other social media apps or no. Seeing how WhatsApp, Facebook and Instagram are all Facebook owned, any data shared across one platform crosses over with the database of another, regardless of whether you have an account or not, completely taking away from the concept of consensual sharing of data. This paper will further discuss how the nature of encryption in India will significantly affect India's newly recognised fundamental right, the Right to Privacy. Various policy developments bring in various user violation concerns and that will be the focus of this research paper.""""","","""""A. Talwar; A. Chaudhary; A. Kumar""""","2022","10.1109/ICRITO56286.2022.9964730","https://ieeexplore.ieee.org/stamp/stamp.jsp?arnumber=9964730","IEEE Conferences"
"","""""","No","Yes","No","Yes","No","""""A Comprehensive Study of Different Security Features in eBanking""""","""""In recent years, banking through mobile banking and usage of debit and credit cards for transfer of money and purchases of goods has increased exponentially due to ecommerce and the introduction of Unified Payments Interface (UPI) by the government of India which allows user easy to use facility with minimal to no charges. To work this mechanism properly, a secure framework is required to avoid the risk of cyber fraud. there has been a great shortfall of security in banking applications in this type of transactions. This article presents a comprehensive study on banking security in e-banking by various techniques like blockchain, data encryption, voice recognition. This article explores the various security and technologies recommended by various researchers for safe and secure use of online banking.""""","","""""N. P. Hemanth Kumar Mothukuri; A. Rakesh; P. Y. Babu; U. Kiran; B. G; B. B. Hazarika""""","2023","10.1109/ICAIS56108.2023.10073735","https://ieeexplore.ieee.org/stamp/stamp.jsp?arnumber=10073735","IEEE Conferences"
"No","""""","No","Yes","Yes","Yes","No","""""Mobile Banking Adoption for Digital Financial Inclusion""""","""""This study aims to determine the challenges customers face during mobile banking adoption. Mobile banking usage is increasing in India, yet not at that pace, especially in rural areas where smartphones’ penetration also increases. It is pertinent to address the issues that encounter the diffusion of mobile banking at the mass label. This research determines customers’ various risks and their impact on mobile banking adoption. This research is a descriptive study that collected data through a structured questionnaire from 250 respondents from a small district of India, Gwalior. The study concluded that the three risks of perceived privacy, perceived security, and convenience risk significantly influence mobile banking adoption. This research will be useful for banking and financial organizations, and policymakers to address these challenges at the grassroots level to further diffuse this advanced banking channel.""""","","""""P. Jain; B. K. Sharma; R. Jain; A. K. Pandey; S. Khare""""","2022","10.1109/ICBIR54589.2022.9786477","https://ieeexplore.ieee.org/stamp/stamp.jsp?arnumber=9786477","IEEE Conferences"
"No","""""","Yes","No","Yes","Yes","No","""""Exploration of Factors Affecting Adoption of Digital Wallet Among Indian Domestic Tourist: Study of Trust and Security Perception""""","""""This research study examines the factors affecting digital wallet adoption among Indian domestic tourist with specific reference to their perception of trust, security and factors of technology acceptance model (TAM).This study identified 15 variables from TAM including variables related to trust and security for the understanding of degree of digital wallet adoption among Indian domestic tourist. Exploratory factor analysis was used to identify the key determinants of digital wallet adoption. Convenient sampling technique is used to gather response from 118 domestic tourists who visited different places at Lucknow, Uttar Pradesh, India.The results of exploratory factor analysis confirm five factors. An extended research can be done on the same topic by including foreign tourist and by covering prominent destinations across various districts in Uttar Pradesh, India.This research paper identifies significant factors that play important role in the adoption of digital wallet among domestic tourist. The valuable contribution of this research can observed in the potential application of identified factors to develop a model for further study of how trust and security affect the adoption of digital wallet among tourists.""""","","""""R. K. Singhal; P. Chauhan; T. Pandey""""","2020","10.1109/ICRITO48877.2020.9197917","https://ieeexplore.ieee.org/stamp/stamp.jsp?arnumber=9197917","IEEE Conferences"
