"No","""""","Yes","No","Yes","Yes","No","""""Customer Perception on Online Banking System in Bhutan: A Study on Mobile Banking of Bank of Bhutan""""","""""A descriptive study on customer satisfaction on mBoB (Mobile Bank of Bhutan) service in Bhutan examined the satisfaction level and challenges faced by mBoB users in Bhutan. For this purpose, a primary data was collected with the help of structured questionnaire consisting 28 items. A convenience sampling technique was adopted to select a total of 150 respondents around Bhutan locality. The data gathered were analyzed with the help of descriptive statistics like simple frequency, percentages and mean. The study revealed that factors to ease of use, security, accessibility for 24 hours were statistically significant and has positive effects on customer satisfaction on using mBoB. The study also shows that strong internet is mandatory to access the service as weak internet hampers while accessing the service.""""","","""""P. Tshering; P. R. Dhungyel; L. Yangdon""""","2018","10.1109/ICCTCT.2018.8551040","https://ieeexplore.ieee.org/stamp/stamp.jsp?arnumber=8551040","IEEE Conferences"
"No","""""","No","Yes","Yes","Yes","No","""""Cybersecurity Awareness Based on Software and E-Mail Security with Statistical Analysis""""","""""The aim of this study is to discover the impact of software security and e-mail security on overall cybersecurity among the students of Imam Abdulrahman Bin Faisal University in Dammam. Another main purpose to conduct this study is to know the level of knowledge students have in the developing countries about the cybersecurity and how much are they mindful of cyber-attacks and the level of awareness among the university students. Two important hypotheses were studied to discover their importance in awareness of cybersecurity. One is software security, and the other is e-mail security. A total of 11 relevant questions were drafted, and then these questions were distributed among the university students, and around 390 responded to the questionnaires. Statistical analysis was performed on the responses using tools. Initial tests such as validity and reliability test, feasibility test of a variable, correlation test, multicollinearity test, multiple regression, and Heteroskedasticity test were conducted using SPSS. And furthermore, multiple linear regression model and coefficient of determination, hypothesis test, ANOVA test, and partial test were conducted using ANOVA. The outcome of the analysis is software security variable (X1) that has a significant and positive effect on cybersecurity awareness (p value ≤0.001, β = 0.192). This shows that having a thorough understanding of software security can raise cybersecurity awareness up to 19.2%. E-mail security variable (X2) has a significant and positive effect on cybersecurityawareness (p-value ≤0.000). This shows that having a thorough understanding of email security can raise cybersecurity awareness up to 31.3%. Software security (X1) and e-mail security (X2) variables simultaneously have a significant effect on cybersecurity awareness (p-value ≤0.000) with a correlation coefficient of 12.1% (R2 = 0.121). This shows that the independent variable used can explain the level of cybersecurity awareness up to 12.1%. Research results show that students are aware of software or application updates. Furthermore, students’ awareness of email security is also good.""""","","""""Alqahtani MA,Kumar V""""","2022","10.1155/2022/6775980","https://doi-org.proxy.bnl.lu/10.1155/2022/6775980","Journal Article"
"No","""""","No","Yes","No","Yes","No","""""Cybersecurity issues on web-based systems in Nigeria: M-learning case study""""","""""There is a rapid growth of the application of mobile devices as a learning aid especially in developing countries such as Nigeria largely due to affordability, interest and availability of mobile handheld devices. Though web-based learning systems such as m-learning are used nowadays to support several learning activities and learners are generally willing to use the devices for learning, cybersecurity negligence poses a huge threat to this beneficial system. This work used questionnaires and interview survey approaches to obtain lecturers and students' opinion and standpoints on the harmful effects of cybersecurity negligence on m-learning as well as possible solutions to the menace of cybersecurity threats. The results of this study identified harmful effects of cybersecurity negligence in m-learning. Also, mitigating approaches were proposed to counter cybersecurity issues on m-learning. It was recommended that appropriate plan and implementation of systems applied in web-based learning must have sufficient cybersecurity administration for m-learning platforms. This must be considered for enhanced learning, efficiency, satisfaction and acceptability of m-learning solutions.""""","","""""S. S. Oyelere; D. I. Sajoh; Y. M. Malgwi; L. S. Oyelere""""","2015","10.1109/CYBER-Abuja.2015.7360510","https://ieeexplore.ieee.org/stamp/stamp.jsp?arnumber=7360510","IEEE Conferences"
"No","""Security and privacy""","Yes","No","Yes","No","Yes","""""Determining factors and impacts of the intention to adopt mobile banking app in Cameroon: Case of SARA by afriland First Bank""""","""""This study aims to know what are the factors determining the adoption of M-Banking app among customers in Cameroon. In other words, what are the factors that influence users in their decisions to adopt and use a system or technology such as the MBanking app, and indirectly, what is the impact of this use on both the customers and financial inclusion? The research model developed relying on a combination of Technology Acceptance Model (TAM ), Unified Theory of Acceptance and Use of Technology ( UTAUT2 ), Information System Success Model ( ISSM ), and Protection Motivation Theory ( PMT ) and other constructs; it was then tested with a sample of 223 users of the “ SARA” M-Banking app of the financial institution called “ Afriland First Bank” . Findings revealed that: (1) utilitarian expectation, hedonic motivation, and status gain, habit, and perceived privacy concern have a significant influence on the intention to adopt M-Banking apps; and (2) the exploitative/explorative use of this technology has an impact on user’s loyalty and satisfaction but also contributes strongly to fostering financial inclusion in Cameroon. Also, the Multi-group analysis was performed on the sample using 2 gender-based groups (males, n=121; females, n=102).""""","Yes","""""Jean Robert {Kala Kamdjoug} and Serge-Lopez Wamba-Taguimdje and Samuel Fosso Wamba and Ingrid Bive'e Kake""""","2021","https://doi.org/10.1016/j.jretconser.2021.102509","https://www.sciencedirect.com/science/article/pii/S0969698921000758","article"
"No","""""","Yes","No","Yes","Yes","No","""""Examining Consumer Adoption and Perception of Mobile Money in Ghana""""","""""This paper investigates the consumer perception of a new electronic financial service in Ghana, namely mobile money MM. We analyse the relationships among five MM-related constructs, which are perceived ease of use PEOU, perceived usefulness PU, perceived mobile money security PMMS, attitude ATT, and intention to use IU. Importantly, the impact of age, family income, and gender on the relationships among the five MM constructs has been studied using a multi-group analysis approach. We find that PEOU, PU, and PMMS are significant determinants of ATT in the MM market in Ghana when age, family income, gender are not considered. However, the relationships among the five constructs exhibit significant variations when age, family income, and gender are considered. We also find an evidence that the effects of age, family income, and gender on consumers' perception of, ATT towards, and intention of using MM are significant in Ghana. The results of this study provide more insights into the research on MM, thus helping the development of marketing strategies for the service.""""","","""""""""","2016","10.1504/IJEF.2016.083490","https://doi-org.proxy.bnl.lu/10.1504/IJEF.2016.083490","Journal Article"
"No","""""","No","No","Yes","Yes","No","""""Examining trust in mobile banking transactions: The case of M-PESA in Kenya""""","""""This chapter examines how trust can emerge and be sustained in the context of mobile transactions. It focuses on M-PESA, a mobile banking system in Kenya, using data from an ethnographic study that was deployed in Kibera—one of Africa’s largest slums. We present research in progress and discuss two main findings. Firstly, interpersonal trust relations between the customers and agents are weak. Customers do not trust the agents with their money. Secondly, the institutional trust relations between the customer and Safaricom, the mobile service provider offering M-PESA, are strong. This means that customers use the M-PESA service because they believe that their money will be kept safe by Safaricom. After providing empirical evidence to substantiate these claims, this study concludes by suggesting questions for future research.""""","","""""Olga Morawczynski; Gianluca Miscione""""","2008","10.1007/978-0-387-84822-8_19","https://link.springer.com/chapter/10.1007/978-0-387-84822-8_19","chapter"
"No","""""","No","Yes","No","No","No","""""Exploiting Multi-Vendor Vulnerabilities as Back-Doors to Counter the Threat of Rogue Small Unmanned Aerial Systems""""","""""A recent trend for many malicious actors, such as: (1) terrorists in Iraq and Syria, (2) lone wolf domestic terrorists, (3) drug cartels, or (4) espionage-minded corporations, has been to use commercial-off-the-shelf (COTS) small unmanned aerial systems (sUAS) (i.e., drones) that can circumvent ground-based defenses to attack or spy on targets, to transport contraband, or to steal information. Because of the low cost of COTS sUAS and the prior success of these uses, this trend is increasing at an alarming rate, leading to the need to counter the malicious usage of sUAS (i.e., rogue sUAS). Researchers, the armed forces, and technologists have all proposed disparate solutions to this problem. There are no comprehensive and compact solutions capable of effectively tracking, identifying, and actively neutralizing the threats associated with rogue sUAS. Thus, we have developed a mobile cyber solution, using rigorous penetration testing across the top sUAS COTS vendors. Based on the market share of these top vendors, our approach is applicable to approximately 90% of all COTS sUAS. We demonstrate that hard-to-patch vulnerabilities (i.e., vulnerabilities that exist across all the top vendors of sUAS) can be used as back-doors to counter the threat of rouge sUAS. Our solution can be launched from a standard laptop or Android mobile device with an external antenna, and is capable of tracking, identifying, and disrupting all Parrot and 3DR sUAS, as well as almost all DJI sUAS (i.e., renders them incapable of video flight) within a 300-meter radius.""""","","""""Watkins L,Ramos J,Snow G,Vallejo J,Robinson WH,Rubin AD,Ciocco J,Jedrzejewski F,Liu J,Li C""""","2018","10.1145/3215466.3215467","https://doi-org.proxy.bnl.lu/10.1145/3215466.3215467","Conference Paper"
"No","""""","Yes","No","","Yes","No","""""Exploring the Influence of Security/Privacy, Trialability, Output Quality and Anxiety on the Adoption of Mobile Decision Support Systems among Nurses: A Developing Country Context""""","""""Nursing staff need to be highly mobile in executing their routine work. Therefore, they may need to catch, deliver and/or receive critical information, orders or alerts via mobile devices at any point of care to help them take immediate decisions/actions or orders to accomplish their tasks quickly. This paper investigates the factors that affect the adoption of mobile decision support systems among nurses in Jordan. Experience and voluntariness as moderators in the proposed model were also investigated. The model was analysed and tested using WarpPLS 5.0 software. The findings of this study have demonstrated that perceived usefulness, perceived ease-of-use, security/privacy, trialability, output quality, and anxiety are important constructs in predicting and affecting intentional behaviour to adopt decision support systems among nurses in Jordan. The model has explained 65% of the variance in behavioural intention. Theoretical contributions and practical implications are outlined. Limitations and suggestions for future studies are discussed.""""","","""""Jaradat MI""""","2021","10.1504/ijmlo.2021.116508","https://doi-org.proxy.bnl.lu/10.1504/ijmlo.2021.116508","Journal Article"
"No","""""","No","No","No","No","No","""""Factors That Influence Challenges and Opportunities of Cryptocurrencies in Developing Countries""""","""""Blockchain is a technology that uses structure in storage. One of the products of blockchain technology is cryptocurrency. Cryptocurrency is an innovation in the fintech field where cryptography-based digital currency can provide various advantages for the community. The problem of cryptocurrencies in developing countries is scalability, security issues, and price volatility. The main advantage with cryptocurrency is low fees and can provide transparency and security of the identity of the owner. This paper is using a systematic literature review on conducting research. The main advantage of this paper is researching the development of blockchain technology that focuses on developing countries where most of the research are conducted for blockchain technology is in developed countries. Cryptocurrencies can help developing countries make various transactions using only smartphones without third parties. However, it is necessary to have sufficient knowledge in using cryptocurrencies because there is still no government regulation, high volatility, and security issues.""""","","""""C. Kurniawan; J. Samuel; Noerlina; T. N. Mursitama""""","2021","10.1109/ICORIS52787.2021.9649457","https://ieeexplore.ieee.org/stamp/stamp.jsp?arnumber=9649457","IEEE Conferences"
"Yes","""""Sensitive data leakage""""","No","Yes","No","No","Yes","""""Forensic Analysis of Mobile Banking Apps""""","""""Over the years, the proliferation of mobile banking applications has been on the increase. Financial institutions are taking advantage of mobile technology to provide accessible, ubiquitous, user-friendly, convenient, and cost-effective services to their customers. The mobile banking applications access and process sensitive user data. As such, they are required to manage such data in a high secure manner and run in secure environment. This study conducts a forensic investigation of twelve popular Android m-banking apps in Nigeria to determine if the generated backups by the mobile OS do not save sensitive data; the application removes sensitive data from view when backgrounded; sensitive data are not held longer than necessary in the memory, with the memory cleared after use; minimum device access security policies are enforced by the app, and users are educated by the app about the type of PII processed and security best practices in using the app. Our findings revealed that while none of the apps saved sensitive data in generated backup, all except one held data of sensitive value in the memory of the test device and did not enforce any device access security policy. Also, none of the apps removed sensitive data when backgrounded. In addition to serving as a source of information for forensic investigators, we believe our study could assist mobile banking app developers in identifying aspects of the development process that need attention, which would lead to better secured apps.""""","Yes","""""Oluwafemi Osho; Uthman L. Mohammed; Nanfa N. Nimzing; Andrew A. Uduimoh; Sanjay Misra""""","2019","10.1007/978-3-030-24308-1_49","https://link.springer.com/chapter/10.1007/978-3-030-24308-1_49","chapter"
"No","""""","No","Yes","Yes","Yes","No","""""Framework for the Provision of User Felt Protected Mobile Banking Services""""","""""The proliferation of mobile devices is a direct sector, which has become the primary means by which individuals complete the vast majority of their daily tasks. Financial institutions are bolstering their expansion plans by emphasizing mobile banking and financial services. However, there are several security issues with mobile banking due to the expanding capabilities of mobile technology. That's why banks need a system to evaluate the safety of their mobile banking services. The cyber-security barriers to mobile banking encountered by SACCOs in Kenya were identified using a survey study methodology, and the strategies used by SACCOs to mitigate the effects of these problems on the supply of mobile banking services were assessed. The research uncovered the risks associated with mobile banking in terms of cyber security. This analysis also assessed the measures taken by SACCOs to guarantee the provision of a safe mobile banking service in the eyes of their customers. The results informed the development of a framework for the provision of mobile banking services that prioritizes customers' sense of safety. After putting the suggested structure through its paces with the help of specialists, it was proven to be quite trustworthy. This paradigm gives SACCOs a way to measure how secure their services are in the eyes of their customers.""""","","""""N. Rawat; D. Bordoloi; A. Dumka""""","2022","10.1109/ICFIRTP56122.2022.10059415","https://ieeexplore.ieee.org/stamp/stamp.jsp?arnumber=10059415","IEEE Conferences"
"No","""""","Yes","No","Yes","Yes","No","""""How Relevant Are Risk Perceptions, Effort, and Performance Expectancy in Mobile Banking Adoption?""""","""""This article provides a comprehensive overview of the adoption process using evidence from m-banking adoption in Pakistan. A survey design was used and 189 responses were received from across Pakistan and analyzed using Smart PLS application. Findings suggest that research on the effect of risk in the adoption process remains inconclusive. Contrarily, consumers have overcome many fears due to the usefulness, indispensability, high security features, and effort expended in the use of financial services delivered through m-banking. Perceived risk's PR direct influence was found to be generally weak. However, PR plays a major role in the pre-adoption process because it's weak and direct inhibiting influence become an ""enhancer"" in the association between effort expectancy EE and the three key TAM/UTAUT constructs [performance expectancy PE, attitude ATT, and adoption intention INT]. Most importantly, the role of EE as a strong driver of PE, ATT, INT, and its significant interaction with PR highlights the unique role that both risk and EE play in the adoption process.""""","","""""Shaikh AA,Glavee-Geo R,Karjaluoto H""""","2018","10.4018/IJEBR.2018040103","https://doi-org.proxy.bnl.lu/10.4018/IJEBR.2018040103","Journal Article"
"No","""""","No","No","No","Yes","No","""""LPMP: An efficient lightweight protocol for mobile payment""""","""""The unprecedented development in wireless and mobile communication has brought forward incredible opportunities for mobile commerce. However the limited processing power, memory, power consumption of mobile devices and security aspects of wireless network are some of the major challenges in expanding mobile commence especially in developing country. In the present paper, an efficient protocol for mobile payment system is proposed that is based on a shared secret between the client and its bank/financial institution. While the protocol possesses all the requisite properties namely - privacy, integrity, authentication and non-repudiation, it minimizes the processing and memory requirement at the client end that makes it especially suited for low end mobile devices.""""","","""""D. M. Tripathi; A. Ojha""""","2012","10.1109/NCETACS.2012.6203295","https://ieeexplore.ieee.org/stamp/stamp.jsp?arnumber=6203295","IEEE Conferences"
"No","""""","No","Yes","No","Yes","No","""""Law Enforcement Access to Password Protected and/or Encrypted Mobile Data""""","""""The use of mobile phones in the commission of crime and terrorism pose serious investigative challenges to law enforcement agencies across the world. The discussion deals primarily with the extent a mobile phone service provider and/or or messaging applications provider and/or manufacturer must assist a law enforcement agency in gaining access to mobile data, specifically where the data is encrypted and/or password protected. It should be established whether a mobile phone service and/or applications provider and/or manufacturer must design security and/or privacy measures in such a way that law enforcement may gain access to the encrypted data. It may be argued that national security interests regarding the investigation of serious crimes such as kidnapping, child pornography, corruption and terrorism outweigh user privacy and user security. Terrorism affects all countries globally and in many instances result in the indiscriminate killing of a large number of people as illustrated by the Paris November 2015, the US December 2015, Abidjan, Ivory Coast, Brussels and Pakistan March 2016 killings. Although a law enforcement agency is pressurized to gather as much as possible evidence to investigate such heinous acts and prevent future attacks, the mobile phone evidence must be gathered within a legal framework that provides checks and balances to prevent the development of a police state resulting in the erosion or elimination of human rights. It is necessary to debate whether banning encryption and/or compelling a provider to have the technology to decrypt encrypted mobile communications or override password protected mobile data would serve as an investigative solution in the interest of national security or whether it would ultimately result in weakening user security and privacy to such an extent that all users around the world would be vulnerable to unlawful intrusions.""""","","""""M. Watney""""","2016","10.1109/ARES.2016.23","https://ieeexplore.ieee.org/stamp/stamp.jsp?arnumber=7784598","IEEE Conferences"
"Yes","""""Vulnerabilities in MM ecosystem""""","No","Yes","Yes","No","Yes","""""Let's Talk Money: Evaluating the Security Challenges of Mobile Money in the Developing World""""","""""Digital money drives modern economies, and the global adoption of mobile phones has enabled a wide range of digital financial services in the developing world. Where there is money, there must be security, yet prior work on mobile money has identified discouraging vulnerabilities in the current ecosystem. We begin by arguing that the situation is not as dire as it may seem---many reported issues can be resolved by security best practices and updated mobile software. To support this argument, we diagnose the problems from two directions: (1) a large-scale analysis of existing financial service products and (2) a series of interviews with 7 developers and designers in Africa and South America. We frame this assessment within a novel, systematic threat model. In our large-scale analysis, we evaluate 197 Android apps and take a deeper look at 71 products to assess specific organizational practices. We conclude that although attack vectors are present in many apps, service providers are generally making intentional, security-conscious decisions. The developer interviews support these findings, as most participants demonstrated technical competency and experience, and all worked within established organizations with regimented code review processes and dedicated security teams.""""","Yes","""""Castle S,Pervaiz F,Weld G,Roesner F,Anderson R""""","2016","10.1145/3001913.3001919","https://doi-org.proxy.bnl.lu/10.1145/3001913.3001919","Conference Paper"
"Yes","""""Certification validation,  crypto misuse; data leakage, liability problems, etc.""""","No","Yes","No","No","Yes","""""Mo(Bile) Money, Mo(Bile) Problems: Analysis of Branchless Banking Applications in the Developing World""""","""""Mobile money, also known as branchless banking, brings much-needed financial services to the unbanked in the developing world. Leveraging ubiquitous cellular networks, these services are now being deployed as smart phone apps, providing an electronic payment infrastructure where alternatives such as credit cards generally do not exist. Although widely marketed as a more secure option to cash, these applications are often not subject to the traditional regulations applied in the financial sector, leaving doubt as to the veracity of such claims. In this paper, we evaluate these claims and perform the first in-depth measurement analysis of branchless banking applications. We first perform an automated analysis of all 46 known Android mobile money apps across the 246 known mobile money providers and demonstrate that automated analysis fails to provide reliable insights. We subsequently perform comprehensive manual teardown of the registration, login, and transaction procedures of a diverse 15% of these apps. We uncover pervasive and systemic vulnerabilities spanning botched certification validation, do-it-yourself cryptography, and myriad other forms of information leakage that allow an attacker to impersonate legitimate users, modify transactions in flight, and steal financial records. These findings confirm that the majority of these apps fail to provide the protections needed by financial services. Finally, through inspection of providers' terms of service, we also discover that liability for these problems unfairly rests on the shoulders of the customer, threatening to erode trust in branchless banking and hinder efforts for global financial inclusion.""""","","""""Reaves B,Scaife N,Bates A,Traynor P,Butler KR""""","2015","","","Conference Paper"
