"App analysis","Type of security issue","Security is only mentioned, not the main focus","Security is the main focus","Users study","Not MAR","Mobile App related (MAR)","Document Title","Abstract","Chosen","Authors","Publication Year","DOI","Link","Content type"
"No","""""SMS and call-based Fraud""""","No","Yes","Yes","No","No","""""""We Even Borrowed Money From Our Neighbor"": Understanding Mobile-Based Frauds Through Victims' Experiences""""","""""Mobile-based scams are on the rise in emerging markets. However, the awareness about these scams and ways to avoid them remains limited among mobile users. We present a qualitative analysis of the dynamics of mobile-based fraud (specifically, SMS and call-based fraud) in Pakistan. We interviewed 96 participants, including different stakeholders in the mobile financial ecosystem: 71 victims of mobile-based scams, seven non-victims, 15 mobile money agents, and three officials from regulatory agencies that investigate mobile-based fraud. Leveraging the perspectives from these stakeholders and analyzing mobile-based fraud with a four-step social-engineering attack framework, we make four concrete contributions: First, we identify the nuances as well as specific tactics, methods, and resources that fraudsters use to scam mobile users. Second, we look at other actors, beyond the victim and the adversary, involved or affected by fraud and their roles at each step of the fraud process. Third, we discuss victims' understanding of mobile fraud, their behavior post-realization, and their attitudes toward reporting fraud. Finally, we discuss possible points of intervention and offer design recommendations to thwart mobile fraud, including addressing the vulnerabilities discovered in the ecosystem, utilizing existing actors to mitigate the consequences of these attacks, and realigning the design of fraud reporting mechanisms with the sociocultural practices.""""","","""""Razaq L,Ahmad T,Ibtasam S,Ramzan U,Mare S""""","2021","10.1145/3449115","https://doi-org.proxy.bnl.lu/10.1145/3449115","Journal Article"
"Yes","""""Security and Privacy of users’ data""""","No","Yes","No","No","Yes","""""A Comparative Study of User Data Security and Privacy in Native and Cross Platform Android Mobile Banking Applications""""","""""This research reports on security and privacy of user data transmitted in Android mobile banking applications. The basis of this approach was to experiment and urge a choice of development framework which ensures user data privacy in banking mobile applications of banks operating in Ghana. The results obtained directed attention to the fact that mobile banking applications developed using cross platform development frameworks (particularly Cordova) make applications less vulnerable by making use of most of the permissions requested ensuring user data privacy as compared to applications development using native development framework.""""","Yes","""""E. D. Ansong; T. Q. Synaepa-Addision""""","2019","10.1109/ICSIoT47925.2019.00007","https://ieeexplore.ieee.org/stamp/stamp.jsp?arnumber=9058363","IEEE Conferences"
"No","""""","No","No","No","Yes","No","""""A Novel Mobile Payment Scheme based on Secure Quick Response Payment with Minimal Infrastructure for Cooperative Enterprise in Developing Countries""""","""""Cooperative play essential role in national development because it can improve the prosperity of society. This paper proposes a novel mobile payment scheme for cooperative. Our scheme modifies the existing QR-Pay system by eliminate the need to connect to the networks, since developing countries still facing difficulties on internet connection. It also proposes two factor authentication and Quick Response (QR) encrypted content to improve the security. Therefore, this model delivers more convenience and security to pay using mobile device easily, with just a snap of a QR code and requires no internet connection. This model is suitable for developing countries.""""","","""""Hatma Suryotrisongko and  Sugiharsono and Bambang Setiawan""""","2012","https://doi.org/10.1016/j.sbspro.2012.11.218","https://www.sciencedirect.com/science/article/pii/S1877042812052032","article"
"No","""Crypto""","Yes","No","No","Yes","No","""""A SWOT Analysis of Mobile Electronic Banking: The Zimbabwe Case""""","""""Zimbabwe is presently undergoing a transformative shift from a prevalently cash-based economy, to one using mobile electronic payments. The cash economy had the unintended consequence of excluding a large portion of the population from financial services, particularly banking services. This shift is significant for the economy because it has enabled the informal sector to tap into banking services. The Zimbabwean informal sector has gradually emerged as a major employer owing to economic challenges that have shrunk the formal sector. This reality has motivated mobile telephony companies to introduce innovative financial products targeting this sector. In this paper we use the SWOT framework to analyse the mobile banking sector in Zimbabwe. Our investigation seeks to inform stakeholders about the sector's potential and to caution about weaknesses that impact on stability and growth. We also characterise the processes involved in mobile banking to enable easy comparison of offerings from different service providers.""""","","""""Nyandoro A,Mahleko B""""","2015","10.1504/IJEF.2015.070531","https://doi-org.proxy.bnl.lu/10.1504/IJEF.2015.070531","Journal Article"
"Yes","""""Vulnerabilities in BBA""""","No","Yes","No","No","Yes","""""A Study of Static Analysis Tools to Detect Vulnerabilities of Branchless Banking Applications in Developing Countries""""","""""The ubiquity of smart phones and their prevalence among the underprivileged has enabled the delivery of financial services to previously unbanked through digital means. At the same time it has exposed the same people to security vulnerabilities of digital infrastructure. In this paper, we analyze 10 Android Digital Financial Services (DFS) applications using static analysis tools and present results to show that off-the-shelf static bug checking tools, can be useful in finding many critical security bugs in DFS applications. Our findings also show that DFS applications from developing countries have more vulnerabilities in application specific code compared with DFS applications from developed countries. However, we observe that general purpose static analysis tools have low specificity for DFS specific bugs, such as the vulnerabilities in the use of cryptography and networking, and there is a need to develop better bug detection tools.""""","Yes","""""Ibrar F,Saleem H,Castle S,Malik MZ""""","2017","10.1145/3136560.3136595","https://doi-org.proxy.bnl.lu/10.1145/3136560.3136595","Conference Paper"
"No","""""Security and Privacy""""","No","Yes","Yes","Yes","No","""""A Survey for User's Awareness and Practices Regarding Smartphone Security and Privacy in Afghanistan""""","""""Although the smartphone has become an integral part of life today, it has also posed some challenges to user security and privacy. To assess learners' and lecturers' awareness of smartphone security and privacy, a study was conducted; based on the findings, some best practices have been suggested for smartphone users. This work reflects the results of a survey conducted in (April - August) 2020 at Sheikh Zayed University (SZU), Khost, Afghanistan, regarding user awareness of smartphone security and privacy. 313 responses were received in total. From the general behaviors and practices of learners and lecturers, it seems that they think communication by smartphone and the use of applications are secure. The findings show learners and lecturers lack sufficient security awareness and are unaware of essential measures to prevent potential illegal access to and retrieval of confidential data from their smartphones. Therefore, users fail to protect their smartphones and private data; they need to be educated to minimize the hazards.""""","","""""J. Hamdard; A. Khamosh; J. H. Chan""""","2020","10.1109/InCIT50588.2020.9310935","https://ieeexplore.ieee.org/stamp/stamp.jsp?arnumber=9310935","IEEE Conferences"
"No","""""","No","No","No","Yes","No","""""A note on modified SET protocol for mobile payment""""","""""Recently a modified SET protocol for mobile payment (MSET) has been proposed in the literature. MSET claims to be a promising protocol for mobile payment. However, we have observed certain flaws and drawbacks in the proposed protocol. In this paper we discuss those flaws and drawbacks and propose counter measures for the same to ensure secure transaction. The first flaw is that a dishonest client can buy goods from a merchant without paying the actual price of the goods. We also observed that the MSET protocol lacks the Non-Repudiation property of transaction. Further, we would like to mention that the modified SET is using certificate, which is having no use once the symmetric key is distributed. This causes communication overhead for the mobile application. As a result the protocol will be useful only for mobiles with reasonably high processing power. With the growing demand of mobile based payment systems in developing countries this could be a disadvantage.""""","","""""D. M. Tripathi""""","2011","","https://ieeexplore.ieee.org/stamp/stamp.jsp?arnumber=6148412","IEEE Conferences"
"No","""""","Yes","No","No","Yes","No","""""A secure mobile payment system using QR code""""","""""Mobile phones have become an inseparable companion for many users, serving much more than just communication tools. In developing countries, the number of mobile phone users exceeds the number of those having bank accounts. Besides, the low banking service penetration and the large migrant communities are another factor to utilize mobile phones for payment purposes. Therefore, mobile payment may find the success it is targeting easily and much faster than in developed countries. There are a lot of variables involved related to Mobile Payments. In this paper, the various models used for Mobile payments are first discussed. Then, the paper will propose a scenario for mobile payment that tackles both concerns of the process, namely: speed of transaction and security, without complicating the process or making it undesirable to users.""""","","""""S. Nseir; N. Hirzallah; M. Aqel""""","2013","10.1109/CSIT.2013.6588767","https://ieeexplore.ieee.org/stamp/stamp.jsp?arnumber=6588767","IEEE Conferences"
"No","""""","No","No","No","Yes","No","""""A secured electronic transaction scheme for mobile banking in Bangladesh incorporating digital watermarking""""","""""Nowadays internet-based banking is getting popularity because of its several advantages, such as ease of operation and virtual monetary activities, i.e., client's physical presence at different bank locations is no more required. However, because of scarcity of accessibility at different locations, cost, and slow speed, number of people using internet communication is a small percentage of the mobile phone users, especially in the developing countries. Moreover, security in internet-based banking is still a major concern. Most of the financial institutions have their own domain and offer web-based transaction facilities. In this paper, we propose a scheme to utilize the internet based existing banking facility via short message service (SMS) available in mobile phone technology without having the internet connection. In view of ensuring a high level of security, we introduce two-level security scheme: voice verification and digital watermarking.""""","","""""S. B. Alam; H. M. D. Kabir; M. N. Sakib; A. B. M. R. Sazzad; C. Shahnaz; S. A. Fattah""""","2010","10.1109/ICITIS.2010.5689618","https://ieeexplore.ieee.org/stamp/stamp.jsp?arnumber=5689618","IEEE Conferences"
"No","""""","No","No","No","Yes","No","""""Adoption and use of mHealth system for livestock farmers in Karura village in Kenya""""","""""The emerging trend of mobile health (mHealth) provides an opportunity for farmers to receive and share information. Mobile health is a service or application that involves voice or data communication for health purposes between a central point and remote locations, it includes the use of mobile phones and other devices as platforms for health related purposes as long as there is some use of a network. Although its endorsement is escalating rapidly, there are concerns that must be considered. This paper establishes the most relevant concerns related to the strengths, weaknesses, opportunities and threats regarding adoption of mHealth. The aim is to explore the potential of mHealth adoption in disseminating information to livestock farmers in Karura village in Kenya. Adoption of this technology is important to livestock farmers, service providers, veterinary doctors, and research institutions.""""","","""""T. Kihara; D. Gichoya""""","2015","10.1109/ISTAFRICA.2015.7190568","https://ieeexplore.ieee.org/stamp/stamp.jsp?arnumber=7190568","IEEE Conferences"
"No","""Fraud via SMS""","No","Yes","Yes","No","No","""""An Assessment of SMS Fraud in Pakistan""""","""""SMS fraud has become a growing concern for those working toward financial inclusion, however, it is often unclear how widespread such threats are in practice. This multi-method study investigates SMS fraud in Pakistan through identification and categorization of fraudulent messages as well as the impact on those who receive such messages. We collect fraudulent SMS messages by various means, including byway of a custom-built Android smartphone application. To complement this, we interview people exposed to SMS fraud and representatives of mobile network operators. Based on our analysis, lottery type fraud schemes dominate SMS fraud in Pakistan, and these schemes have the greatest impact on vulnerable low-income, rural populations. We offer a simple heuristic for fraud detection that has a high accuracy rate and is adaptable to evolving fraud schemes, and conclude with a recommendation for a fraud mitigation strategy to target fraudster call back numbers.""""","","""""Pervaiz F,Nawaz RS,Ramzan MU,Usmani MZ,Mare S,Heimerl K,Kamiran F,Anderson R,Razaq L""""","2019","10.1145/3314344.3332500","https://doi-org.proxy.bnl.lu/10.1145/3314344.3332500","Conference Paper"
"No","""Security and privacy""","Yes","No","Yes","Yes","No","""""An Empirical Investigation on Acceptance of Mobile Payment System Services in Jordan: Extending UTAUT2 Model with Security and Privacy""""","""""Several developed and developing countries have launched a mobile payment system service, which is known in Jordan as Jordan Mobile Payment (JoMoPay) system to overcome the drawbacks of traditional payment system. The system supports payment transactions by utilising mobile phones applications. However, the acceptance of JoMoPay system in Jordan is still below the level of expectation. This study was undertaken to understand and explain the acceptance of JoMoPay system based on extending the unified theory of acceptance and use of technology (UTAUT2) model in the Jordanian context. The model was extended by considering two additional constructs namely; security and privacy. Utilising a self-reported survey, collected data was analysed using structural equation modelling (SEM) to test the research model. Five constructs were found to be the determinants of behavioural intention to use JoMoPay system, namely performance expectancy, social influence, price value, security and privacy. Together they account for 61.4% of the variance in behavioural intention. However, effort expectancy, facilitating condition and hedonic motivation did not have a significant impact on behavioural intention to use JoMoPay system and hence the related hypotheses were not supported. Lastly, conclusions, limitations and future research directions will be discussed further in the last section of the paper.""""","","""""Al-Okaily M,Rahman MS,Ali A,Abu-Shanab E,Masa'deh R""""","2023","10.1504/ijbis.2023.128306","https://doi-org.proxy.bnl.lu/10.1504/ijbis.2023.128306","Journal Article"
"No","""""","No","Yes","No","Yes","No","""""Analysis of mobile payment security measures and different standards""""","""""If mobile technology fulfils its possibilities, then users could be making payments with their mobile phones. Researchers in Pakistan look at the technologies and security concepts.""""","","""""Saleem Kadhiwal and Anwar Usman Shaheed Zulfiquar""""","2007","https://doi.org/10.1016/S1361-3723(07)70077-5","https://www.sciencedirect.com/science/article/pii/S1361372307700775","article"
"No","""""","Yes","No","No","Yes","No","""""Analysis of mobile wallet model applicable for Ecuador""""","""""Nowadays, the combination of fast growing of mobile phones with the great development of mobile technologies have caused a strong growth potential for mobile electronic commerce across the developing countries as Ecuador. This paper describes the main headlines in order to implement the mobile wallet in Ecuador. There are important challenges to overcome, like the essential agreement between government, mobile networks operators (MNO), banks, consumers, merchants, and others. In addition, this article will be focus on the security and regulatory aspects. The purpose of this study is to provide a starting point to raise a technical analysis of the mobile wallet with all aspects that compose it; reviewing the available technologies and the existing business models to conclude which is the most viable for application in Ecuador.""""","","""""L. F. G. Vásquez; D. A. C. Dután; E. E. O. Figueroa""""","2016","10.1109/EIConRusNW.2016.7448313","https://ieeexplore.ieee.org/stamp/stamp.jsp?arnumber=7448313","IEEE Conferences"
"Yes","""Permissions abused""","No","Yes","No","No","Yes","""""Analysis of the Impact of Permissions on the Vulnerability of Mobile Applications""""","""""In this paper, we explored the potential risks of authorizations unexplained by benign apps in order to maintain the confidentiality and availability of personal data. More precisely, we focused on the mechanisms for managing risk permissions under Android to limit the impact of these permissions on vulnerability vectors. We analyzed a sample of forty (40) apps developed in Burkina Faso and identified abuses of dangerous authorizations in several apps in relation to their functional needs. We also discovered combinations of dangerous permissions because it exposes the confidentiality of the data. This analysis allowed us to establish a link between permissions and vulnerabilities, as a source of risk of data security. These risks facilitate exploits of privileges that should be reduced. We have therefore proposed the need to coordinate resolution mechanisms to the administrators, developers, users to better guide the required permissions by benign apps on Android.""""","Yes","""""Gouayon Koala; Didier Bassolé; Aminata Zerbo/Sabané; Tegawendé F. Bissyandé; Oumarou Sié""""","2020","10.1007/978-3-030-41593-8_1","https://link.springer.com/chapter/10.1007/978-3-030-41593-8_1","chapter"
"No","""""","No","No","Yes","Yes","No","""""Building cyber security awareness in a developing country: Lessons from Myanmar""""","""""The paper discusses the arguments for inclusion of cybersecurity awareness building in development assistance programs. We note that cybersecurity awareness building can strengthen the resilience of productivity-enhancing services, such as mobile banking and e-payment systems, and benefit economic growth. We develop a typology of cybersecurity strategies involving government, the private sector and the international community. The paper describes an Australian-funded program delivered by Monash University to overcome cyber errorism by strengthening cybersecurity capacity and awareness in Myanmar and explains how and why it was delivered. Drawing on the program's experience, the paper identifies various challenges to managing an effective program as well as eight lessons learned which might be applicable to other programs. Key amongst the lessons learned is the need for a solid understanding of how the internet is accessed and used in the host country, and the need for local content to attract target audience attention.""""","","""""Lennon Y.C. Chang and Nicholas Coppel""""","2020","https://doi.org/10.1016/j.cose.2020.101959","https://www.sciencedirect.com/science/article/pii/S0167404820302352","article"
"No","""Fraud""","No","Yes","No","Yes","No","""""Classifying Swahili Smishing Attacks for Mobile Money Users: A Machine-Learning Approach""""","""""Due to the massive adoption of mobile money in Sub-Saharan countries, the global transaction value of mobile money exceeded  $\$ $ 2 billion in 2021. Projections show transaction values will exceed  $\$ $ 3 billion by the end of 2022, and Sub-Saharan Africa contributes half of the daily transactions. SMS (Short Message Service) phishing cost corporations and individuals millions of dollars annually. Spammers use Smishing (SMS Phishing) messages to trick a mobile money user into sending electronic cash to an unintended mobile wallet. Though Smishing is an incarnation of phishing, they differ in the information available and attack strategy. As a result, detecting Smishing becomes difficult. Numerous models and techniques to detect Smishing attacks have been introduced for high-resource languages, yet few target low-resource languages such as Swahili. This study proposes a machine-learning based model to classify Swahili Smishing text messages targeting mobile money users. Experimental results show a hybrid model of Extratree classifier feature selection and Random Forest using TFIDF (Term Frequency Inverse Document Frequency) vectorization yields the best model with an accuracy score of 99.86%. Results are measured against a baseline Multinomial Naïve-Bayes model. In addition, comparison with a set of other classic classifiers is also done. The model returns the lowest false positive and false negative of 2 and 4, respectively, with a Log-Loss of 0.04. A Swahili dataset with 32259 messages is used for performance evaluation.""""","","""""I. S. Mambina; J. D. Ndibwile; K. F. Michael""""","2022","10.1109/ACCESS.2022.3196464","https://ieeexplore.ieee.org/stamp/stamp.jsp?arnumber=9849641","IEEE Journals"
"No","""""","Yes","No","No","Yes","No","""""Computing Security in the Developing World: A Case for Multidisciplinary Research""""","""""Technology users in the developing world face a varied and complex set of computer security concerns. These challenges are deeply tied to a range of contextual factors including poor infrastructure, non-traditional usage patterns, and different attitudes towards security, which make simply importing security solutions from industrialized nations inadequate. Recognizing this, we describe some of the specific security risks in developing regions and their relationships with technical, political, social, and economic factors. We present concrete examples of how these factors affect the security of individuals, groups, and key applications such as mobile banking. Our analysis highlights the urgency of the concerns that need attention and presents an important intellectual challenge for the research community.""""","","""""Ben-David Y,Hasan S,Pal J,Vallentin M,Panjwani S,Gutheim P,Chen J,Brewer EA""""","2011","10.1145/1999927.1999939","https://doi-org.proxy.bnl.lu/10.1145/1999927.1999939","Conference Paper"
"No","""""","Yes","No","Yes","Yes","No","""""Consumer Adoption of Mobile Payment Systems in Malawi: Case of Airtel Malawi ZAP in Blantyre City""""","""""Mobile payment enables consumers to purchase goods and services as well as transfer money using a mobile phone. This qualitative study aimed at investigating the factors that are affecting consumers in using mobile payment in Malawi using Zap [mobile payment system] as an example. Snowball sampling technique was used to identify study participants in Blantyre District. Inductive and deductive qualitative data analyses were carried out based on the transcriptions of interviews. Study findings show that relative advantage, complexity, compatibility, cost, trust and security, network externalities and situational factors affect use of mobile payment systems. In addition, personal characteristics and use of mass media play a role in the adoption of mobile payment systems. The findings reinforce the existing theory of Diffusion of Innovation and adoption of mobile payment systems. The study recommends improvement in the network stability, extension of the service to banks and utility service providers, and recruitment of more mobile payment agents across the country.""""","","""""Menard Nyirenda; Patrick Albert Chikumba""""","2014","10.1007/978-3-319-08368-1_22","https://link.springer.com/chapter/10.1007/978-3-319-08368-1_22","chapter"
